{
  "$schema": "https://json-schema.org/draft/2020-12/schema",
  "$id": "enterprise_data_card.v1",
  "type": "object",
  "required": ["data_card_id", "source_benchmark_id", "data_kind", "lineage", "visibility", "truth_scope", "status"],
  "properties": {
    "data_card_id": {"type": "string", "pattern": "^DATA-"},
    "source_benchmark_id": {"type": "string"},
    "data_kind": {"type": "string"},
    "lineage": {"type": "array", "minItems": 1},
    "visibility": {"type": "object", "required": ["agent", "verifier", "author"], "properties": {"agent": {"type": "array"}, "verifier": {"type": "array"}, "author": {"type": "array"}}},
    "truth_scope": {"type": "string"},
    "status": {"enum": ["DRAFT", "REVIEW_REQUIRED", "FROZEN"]}
  }
}
